question,answer
What is an LLM?,An LLM (Large Language Model) is a type of artificial intelligence model designed to understand and generate human-like text.
How do LLMs work?,LLMs work by training on vast amounts of text data and learning patterns in language to generate coherent and contextually relevant responses.
What are some examples of LLMs?,Examples include GPT-3 BERT T5 and OpenAI's Codex.
What is GPT-3?,GPT-3 (Generative Pre-trained Transformer 3) is a state-of-the-art language model developed by OpenAI.
What does pre-training mean in LLMs?,Pre-training involves training a model on a large dataset to learn general language patterns before fine-tuning it on a specific task.
How is an LLM fine-tuned?,Fine-tuning involves training a pre-trained model on a smaller task-specific dataset to improve performance on that particular task.
What is a transformer model?,A transformer model is a type of deep learning architecture that uses self-attention mechanisms to process and generate sequences of text.
Why are LLMs important?,LLMs are important because they enable a wide range of natural language processing applications such as chatbots translation and content generation.
What is BERT?,BERT (Bidirectional Encoder Representations from Transformers) is a pre-trained transformer model designed for natural language understanding tasks.
How does BERT differ from GPT-3?,BERT is primarily used for understanding language while GPT-3 is designed for generating language. BERT uses a bidirectional approach while GPT-3 uses a unidirectional approach.
What is T5?,T5 (Text-To-Text Transfer Transformer) is a model developed by Google that treats every NLP problem as a text-to-text task.
What are some applications of LLMs?,Applications include chatbots virtual assistants language translation text summarization and content creation.
How are LLMs trained?,LLMs are trained using large datasets of text typically through supervised learning techniques.
What is the difference between LLMs and traditional NLP models?,LLMs are more advanced and capable of understanding and generating more complex and coherent text compared to traditional NLP models.
What is the role of self-attention in transformers?,Self-attention allows the model to weigh the importance of different words in a sentence improving the understanding of context and relationships between words.
How do LLMs handle context?,LLMs use attention mechanisms to maintain and leverage context from previous text to generate relevant responses.
What is zero-shot learning?,Zero-shot learning is the ability of a model to perform a task it was not explicitly trained on using general knowledge learned during pre-training.
What is few-shot learning?,Few-shot learning refers to the ability of a model to quickly learn a new task with only a few examples or instances.
What is a prompt in LLMs?,A prompt is an input text given to an LLM to guide its response or output.
How do you evaluate the performance of LLMs?,Performance is typically evaluated using metrics such as perplexity accuracy and human evaluations of generated text quality.
What is transfer learning?,Transfer learning is the process of leveraging a pre-trained model on one task and fine-tuning it for a different related task.
What are embeddings in NLP?,Embeddings are dense vector representations of words or phrases that capture their meanings and relationships in a continuous space.
How do LLMs handle ambiguity in language?,LLMs use context and learned patterns from training data to resolve ambiguity and generate appropriate responses.
What is a language model's vocabulary?,A vocabulary is the set of words and subwords that a language model recognizes and processes.
How do LLMs deal with out-of-vocabulary words?,LLMs use techniques like subword tokenization to handle out-of-vocabulary words by breaking them into smaller recognizable parts.
What is tokenization in NLP?,Tokenization is the process of breaking text into smaller units such as words or subwords for processing by a language model.
How does beam search work in text generation?,Beam search is a decoding algorithm that explores multiple possible outputs simultaneously and selects the best one based on a scoring function.
What is the purpose of the hidden states in transformers?,Hidden states store intermediate representations of the input text at each layer of the transformer capturing contextual information.
How do you mitigate biases in LLMs?,Biases can be mitigated by using diverse training data applying debiasing techniques and conducting thorough evaluations of model outputs.
What is a language model's capacity?,Capacity refers to the model's size typically measured by the number of parameters it contains which affects its ability to learn and generate text.
How do you fine-tune an LLM for a specific task?,Fine-tuning involves training the pre-trained model on a task-specific dataset with additional supervised learning steps.
What is perplexity in language models?,Perplexity is a measure of how well a language model predicts a sample of text with lower values indicating better performance.
How do LLMs generate text?,LLMs generate text by predicting the next word or token in a sequence based on the context provided by the previous words.
What is the role of attention heads in transformers?,Attention heads allow the model to focus on different parts of the input text simultaneously capturing various aspects of the context.
How do you control the output length of an LLM?,Output length can be controlled using parameters like maximum length stopping criteria and sampling strategies.
What is the difference between greedy search and beam search?,Greedy search selects the highest probability token at each step while beam search explores multiple sequences and selects the best one overall.
What is a masked language model?,A masked language model predicts missing words in a sentence which helps it learn bidirectional context representations.
How do LLMs handle multiple languages?,LLMs can be trained on multilingual datasets to handle multiple languages and generate text in different languages.
What is a positional encoding in transformers?,Positional encoding is used to inject information about the relative positions of tokens in a sequence helping the model understand the order of words.
How do LLMs learn syntactic and semantic relationships?,LLMs learn syntactic and semantic relationships by training on large datasets capturing patterns in language structure and meaning.
What is transfer learning in LLMs?,Transfer learning in LLMs involves using a pre-trained model and adapting it to a new related task through additional training.
How do you interpret the outputs of an LLM?,Outputs can be interpreted by analyzing the generated text attention weights and hidden states to understand the model's reasoning.
What is a dialogue model?,A dialogue model is designed to generate conversational responses enabling natural language interactions with users.
How do LLMs handle rare words or phrases?,LLMs handle rare words or phrases by leveraging context and subword tokenization to generate appropriate responses.
What is the difference between a decoder-only and an encoder-decoder model?,Decoder-only models generate text based on context while encoder-decoder models use an encoder to process input text and a decoder to generate output.
What is the importance of the training dataset for LLMs?,The training dataset's quality and diversity significantly impact the model's ability to generalize and generate accurate responses.
How do you fine-tune an LLM for a specific domain?,Fine-tuning for a specific domain involves training the model on domain-specific data to adapt its knowledge and improve performance in that area.
What is a language model's temperature parameter?,The temperature parameter controls the randomness of the generated text with lower values making the output more deterministic.
How do you handle long documents with LLMs?,Long documents can be handled by splitting them into smaller chunks and processing each chunk individually or using models designed for longer contexts.
What is the role of layer normalization in transformers?,Layer normalization stabilizes and accelerates training by normalizing the inputs to each layer improving convergence and performance.
How do LLMs handle questions with multiple valid answers?,LLMs generate responses based on context and training data potentially providing different valid answers depending on the input and learned patterns.
What is the impact of model size on performance?,Larger models generally perform better due to their increased capacity to learn complex patterns but they require more computational resources.
How do LLMs handle negation in text?,LLMs use context and learned language patterns to understand and appropriately respond to negations in text.
What is the difference between pre-training and fine-tuning?,Pre-training involves learning general language patterns from large datasets while fine-tuning adapts the model to specific tasks or domains.
How do LLMs manage context across long conversations?,LLMs manage context by maintaining a history of previous interactions and using attention mechanisms to reference relevant parts of the conversation.
What is a multi-task language model?,A multi-task language model is designed to perform multiple NLP tasks using a single model by learning shared representations and patterns.
How do you evaluate the quality of text generated by LLMs?,Quality can be evaluated using metrics like BLEU ROUGE and human evaluations of coherence relevance and fluency.
What is a generative model?,A generative model is designed to generate new data samples such as text or images based on learned patterns from training data.
How do LLMs handle incomplete input?,LLMs handle incomplete input by generating plausible completions based on the available context and learned language patterns.
What is the significance of the attention mechanism in transformers?,The attention mechanism allows transformers to focus on different parts of the input sequence capturing dependencies and relationships between words.
How do you prevent LLMs from generating offensive content?,Preventing offensive content involves using filtered training data applying safety mechanisms and conducting thorough evaluations of outputs.
What is the difference between open-domain and closed-domain question answering?,Open-domain question answering can handle any question without restrictions while closed-domain focuses on questions within a specific topic or domain.
How do LLMs handle idiomatic expressions?,LLMs handle idiomatic expressions by learning patterns and meanings from training data generating appropriate responses based on context.
What is a bidirectional language model?,A bidirectional language model processes text in both directions capturing context from both preceding and following words in a sentence.
How do you customize an LLM for a specific application?,Customization involves fine-tuning the model on task-specific data adjusting hyperparameters and incorporating domain-specific knowledge.
What is the role of dropout in training LLMs?,Dropout is a regularization technique that prevents overfitting by randomly dropping units during training improving the model's generalization ability.
How do LLMs handle multiple input modalities?,LLMs can be extended to handle multiple input modalities such as text and images by incorporating additional processing layers and embeddings.
What is a causal language model?,A causal language model generates text by predicting the next word based on previous words using a unidirectional approach.
How do you ensure the robustness of LLMs?,Robustness can be ensured by training on diverse datasets using data augmentation and conducting extensive evaluations under various conditions.
What is the role of the feedforward layer in transformers?,The feedforward layer processes the output of the attention mechanism applying additional transformations to improve representation learning.
How do LLMs handle ambiguity in questions?,LLMs handle ambiguity by leveraging context and learned patterns to generate responses that are contextually appropriate and relevant.
What is a sequence-to-sequence model?,A sequence-to-sequence model generates an output sequence from an input sequence commonly used in tasks like translation and summarization.
How do you optimize the performance of LLMs?,Performance can be optimized by fine-tuning on task-specific data using efficient architectures and leveraging hardware accelerators like GPUs.
What is a context window in LLMs?,The context window is the range of input tokens that the model considers when generating a response affecting the quality and coherence of the output.
How do LLMs handle spelling errors in input text?,LLMs handle spelling errors by using context to infer the intended meaning and generate appropriate responses based on learned patterns.
What is transferability in LLMs?,Transferability refers to the model's ability to apply knowledge learned from one task or domain to other related tasks or domains.
How do LLMs manage the trade-off between specificity and generality?,LLMs balance specificity and generality by learning general language patterns while being fine-tuned on task-specific data to improve relevance.
What is the role of hyperparameters in training LLMs?,Hyperparameters control various aspects of the training process such as learning rate and batch size influencing the model's performance and convergence.
How do LLMs handle real-time interactions?,LLMs handle real-time interactions by processing input text quickly and generating responses within a short time frame often using optimized inference techniques.
What is a memory-augmented language model?,A memory-augmented language model incorporates external memory structures to store and retrieve information enhancing its ability to handle long-term dependencies.
How do you evaluate the interpretability of LLMs?,Interpretability can be evaluated by analyzing attention weights hidden states and generated text to understand the model's reasoning and decision-making.
What is the difference between abstractive and extractive summarization?,Abstractive summarization generates a new summary based on the input text while extractive summarization selects and combines segments from the input text.
How do LLMs handle sarcasm and irony?,LLMs handle sarcasm and irony by learning patterns and contextual cues from training data generating responses that consider the intended meaning.
What is a multi-modal language model?,A multi-modal language model processes and generates text in conjunction with other data modalities such as images or audio.
How do LLMs manage the balance between coherence and creativity?,LLMs manage coherence and creativity by learning language patterns that balance logical consistency with the ability to generate novel and interesting text.
What is the role of the embedding layer in transformers?,The embedding layer converts input tokens into dense vector representations capturing semantic information for processing by the model.
How do LLMs handle user feedback and interaction?,LLMs handle user feedback by updating their responses based on the input and maintaining context across interactions to improve relevance and coherence.